{"$id":"https://readme-showcase.local/schemas/approval-envelope.v2.schema.json","$schema":"https://json-schema.org/draft/2020-12/schema","$defs":{"branch":{"maxLength":128,"minLength":1,"pattern":"^(?![-/.])(?!.*(?:\\.\\.|//|@\\{|\\\\| ))(?!.*(?:/|\\.|\\.lock)$)[A-Za-z0-9._/-]+$","type":"string"},"candidate":{"additionalProperties":false,"properties":{"path":{"$ref":"#/$defs/path"},"sha256":{"$ref":"#/$defs/sha256"}},"required":["path","sha256"],"type":"object"},"commit":{"pattern":"^[0-9a-f]{40}$","type":"string"},"path":{"maxLength":4096,"minLength":1,"not":{"anyOf":[{"pattern":"^(?:/|~/)"},{"pattern":"(?:^|/)\\.{1,2}(?:/|$)"},{"pattern":"\\\\"}]},"type":"string"},"repository":{"pattern":"^[A-Za-z0-9][A-Za-z0-9_.-]{0,99}/[A-Za-z0-9][A-Za-z0-9_.-]{0,99}$","type":"string"},"sha256":{"pattern":"^[0-9a-f]{64}$","type":"string"}},"additionalProperties":false,"properties":{"actions":{"items":false,"maxItems":4,"minItems":4,"prefixItems":[{"const":"create-branch"},{"const":"commit-files"},{"const":"push-branch"},{"const":"open-pull-request"}],"type":"array"},"base_sha":{"$ref":"#/$defs/commit"},"candidate_hashes":{"items":{"$ref":"#/$defs/candidate"},"maxItems":256,"minItems":1,"type":"array","uniqueItems":true},"decision":{"enum":["approve","reject"]},"evaluation_sha256":{"$ref":"#/$defs/sha256"},"preview":{"additionalProperties":false,"properties":{"path":{"const":"output/preview/index.html"},"preview_sha256":{"$ref":"#/$defs/sha256"},"report_path":{"const":"output/preview/report.json"},"report_sha256":{"$ref":"#/$defs/sha256"}},"required":["path","preview_sha256","report_path","report_sha256"],"type":"object"},"pr_fingerprint":{"$ref":"#/$defs/sha256"},"proposed_branch":{"$ref":"#/$defs/branch"},"repository":{"$ref":"#/$defs/repository"},"schema_version":{"const":2}},"required":["schema_version","decision","repository","base_sha","proposed_branch","pr_fingerprint","candidate_hashes","evaluation_sha256","preview","actions"],"title":"Reject-by-default approval envelope v2","type":"object","x-python-semantic-validation":{"codes":["E_APPROVAL_ACTIONS","E_APPROVAL_CANDIDATES","E_APPROVAL_DECISION","E_APPROVAL_FINGERPRINT","E_EVALUATION_DRIFT","E_PREVIEW_DRIFT"]}}
