{"actions":["create-branch","commit-files","push-branch","open-pull-request"],"base_sha":"aaaaaaaaaaaaaaaaaaaaaaaaaaaaaaaaaaaaaaaa","candidate_hashes":[{"path":"README.md","sha256":"bbbbbbbbbbbbbbbbbbbbbbbbbbbbbbbbbbbbbbbbbbbbbbbbbbbbbbbbbbbbbbbb"},{"path":"assets/readme/hero.svg","sha256":"cccccccccccccccccccccccccccccccccccccccccccccccccccccccccccccccc"}],"decision":"reject","evaluation_sha256":"dddddddddddddddddddddddddddddddddddddddddddddddddddddddddddddddd","pr_fingerprint":"eeeeeeeeeeeeeeeeeeeeeeeeeeeeeeeeeeeeeeeeeeeeeeeeeeeeeeeeeeeeeeee","preview":{"path":"output/preview/index.html","preview_sha256":"ffffffffffffffffffffffffffffffffffffffffffffffffffffffffffffffff","report_path":"output/preview/report.json","report_sha256":"1111111111111111111111111111111111111111111111111111111111111111"},"proposed_branch":"readme-showcase/aaaaaaaaaaaa","repository":"owner/repo","schema_version":2}
